{"cohortEligibility":{"eligibleLabels":["CONFIRMED_FRAUD","CONFIRMED_LEGITIMATE"],"maximumRecords":1000,"metricBasis":"BOUNDED_ANALYST_FEEDBACK_BY_EXACT_ML_MODEL_ARTIFACT","policy":"BINARY_ANALYST_FEEDBACK_WITH_EXACT_ML_PREDICTION","requiresExactMlPredictionEvidence":true,"timeBasis":"FEEDBACK_CREATED_AT"},"coverage":{"sourceInvalid":false,"sourceTruncated":false,"status":"COMPLETE"},"evaluationSummary":{"classBalance":{"negativeClassCount":2,"positiveClassCount":2},"evaluationSubject":{"featureContractVersion":"feature-contract-v2","identityCompleteness":"COMPLETE","modelArtifactSha256":"aaaaaaaaaaaaaaaaaaaaaaaaaaaaaaaaaaaaaaaaaaaaaaaaaaaaaaaaaaaaaaaa","modelName":"python-logistic-fraud-model","modelVersion":"2026-10-15.shadow","subjectType":"ML_MODEL"},"evaluationWindow":{"fromInclusive":"2026-06-01T00:00:00Z","timeBasis":"FEEDBACK_CREATED_AT","toInclusive":"2026-06-09T23:59:59Z"},"generatedAt":"2026-06-10T00:00:00Z","limitations":["ANALYST_FEEDBACK_LABELS_ARE_REVIEW_SIGNALS","ML_PREDICTION_METRICS_REQUIRE_DIRECT_ML_OUTPUT_SIGNALS","MODEL_SPECIFIC_EVALUATION_DOES_NOT_APPROVE_PROMOTION","MODEL_SPECIFIC_EVALUATION_DOES_NOT_AUTHORIZE_PAYMENTS","MODEL_SPECIFIC_EVALUATION_DOES_NOT_CHANGE_SCORING"],"lineagePolicy":{"identityMismatchBehavior":"EXCLUDE","identityMismatchReason":"MODEL_IDENTITY_MISMATCH","policy":"REQUESTED_EXACT_ARTIFACT_IDENTITY"},"metricBasis":"BOUNDED_ANALYST_FEEDBACK_BY_EXACT_ML_MODEL_ARTIFACT","population":{"recordsConsidered":4,"recordsEvaluated":4,"recordsExcludedIdentityMismatch":0,"recordsExcludedInvalidPredictionEvidence":0,"recordsExcludedMissingPredictionEvidence":0,"recordsExcludedSourceIdentityMismatch":0,"recordsExcludedUnexpectedMissingPredictionEvidence":0,"recordsWithPredictionEvidence":4},"reportType":"ML_MODEL_FEEDBACK_DATASET_EVALUATION_V1","sourceDataset":{"datasetVersion":"feedback-dataset-v3","excludedGovernanceReviewCount":0,"excludedUnresolvedCount":0,"rawRowsRead":4,"recordsReturned":4,"sha256":"e9eb5d575af2a7a3b66d4a8461e00a2c1c9d95c23bd665bccb3b1e6bfb861d97","skippedInvalidSourceRecordCount":0,"skippedMissingRequiredFieldCount":0,"truncated":false},"supportedMetrics":{"classBalance":{"available":true,"reason":null},"mlPredictionMetrics":{"available":true,"classificationPolicy":"RISK_HIGH_OR_CRITICAL_POSITIVE_V1","falseNegative":0,"falseNegativeRate":{"available":true,"reason":null,"value":0.0},"falsePositive":0,"falsePositiveRate":{"available":true,"reason":null,"value":0.0},"precision":{"available":true,"reason":null,"value":1.0},"precisionAtK":{"1":{"actualK":1,"requestedK":1,"value":{"available":true,"reason":null,"value":1.0}},"2":{"actualK":2,"requestedK":2,"value":{"available":true,"reason":null,"value":1.0}},"4":{"actualK":4,"requestedK":4,"value":{"available":true,"reason":null,"value":0.5}}},"rankingPolicy":"EXACT_ML_PREDICTION_SCORE_DESC_EVALUATION_RECORD_ID_ASC_V1","reason":null,"recall":{"available":true,"reason":null,"value":1.0},"recallAtK":{"1":{"actualK":1,"requestedK":1,"value":{"available":true,"reason":null,"value":0.5}},"2":{"actualK":2,"requestedK":2,"value":{"available":true,"reason":null,"value":1.0}},"4":{"actualK":4,"requestedK":4,"value":{"available":true,"reason":null,"value":1.0}}},"recordsEvaluated":4,"trueNegative":2,"truePositive":2,"truePositiveRate":{"available":true,"reason":null,"value":1.0}},"rulesVsMlDisagreement":{"analystLabeledFraudByCategory":{"BOTH_HIGH":1,"BOTH_LOW":0,"ML_HIGH_RULES_LOW":1,"RULES_HIGH_ML_LOW":0},"analystLabeledFraudRecordsCompared":2,"analystLabeledFraudRecordsExcludedRulesEvidenceUnavailable":0,"available":true,"categoryCounts":{"BOTH_HIGH":1,"BOTH_LOW":1,"ML_HIGH_RULES_LOW":1,"RULES_HIGH_ML_LOW":1},"classificationPolicy":"RISK_HIGH_OR_CRITICAL_POSITIVE_V1","disagreementRate":{"available":true,"reason":null,"value":0.5},"reason":null,"recordsCompared":4,"recordsExcludedRulesEvidenceUnavailable":0,"recordsWithExactMlEvidence":4}},"warnings":[]},"generatedAt":"2026-06-10T00:00:01Z","governance":{"diagnosticOnly":true,"paymentAuthorizationAuthority":"NONE","promotionAuthority":"NONE","runtimeDecisionAuthority":"NONE","thresholdChangeAuthority":"NONE","workflowAuthority":"NONE"},"operationalDiagnostics":{"fallbackRate":{"available":false,"denominator":null,"numerator":null,"reason":"EXACT_ARTIFACT_FALLBACK_EVIDENCE_UNAVAILABLE","timeBasis":null,"value":null},"mlLatencyP95":{"available":false,"reason":"EXACT_ARTIFACT_LATENCY_EVIDENCE_UNAVAILABLE","sampleSize":null,"timeBasis":null,"valueMilliseconds":null},"mlReasonCodeDistribution":{"available":false,"counts":{},"reason":"EXACT_ARTIFACT_REASON_CODE_EVIDENCE_UNAVAILABLE","recordsEvaluated":null,"timeBasis":null}},"populationType":"LABELED_FEEDBACK","reportType":"EXACT_MODEL_SHADOW_PERFORMANCE_V1","schemaVersion":"exact-model-shadow-performance-v1","sourceEvaluation":{"artifactIntegrityVerification":"VERIFIED_REPORT_AND_MANIFEST","artifactSetVersion":"ml-model-feedback-dataset-evaluation-artifact-set-v1","externalAttestation":"NOT_PROVIDED","immutableStorageGuarantee":"NOT_CLAIMED","manifestSha256":"1111111111111111111111111111111111111111111111111111111111111111","reportGeneratedAt":"2026-06-10T00:00:00Z","reportType":"ML_MODEL_FEEDBACK_DATASET_EVALUATION_V1","sourceDatasetVerificationLevel":"VERIFIED_AGAINST_SOURCE_BYTES"}}
